{
  "$schema": "https://json-schema.org/draft-07/schema#",
  "$id": "https://vendra.dev/storefront.schema.json",
  "title": "Vendra Storefront Runtime Config",
  "type": "object",
  "additionalProperties": false,
  "required": [
    "slug",
    "domain",
    "siteUrl",
    "name",
    "businessType",
    "priceCurrency",
    "address",
    "contact",
    "social"
  ],
  "properties": {
    "slug": {
      "type": "string",
      "minLength": 1
    },
    "domain": {
      "type": "string",
      "minLength": 1
    },
    "siteUrl": {
      "type": "string",
      "format": "uri",
      "minLength": 1
    },
    "businessType": {
      "type": "string",
      "minLength": 1
    },
    "priceCurrency": {
      "type": "string",
      "minLength": 1
    },
    "ogImage": {
      "type": "string"
    },
    "messages": {
      "type": "object"
    },
    "name": {
      "type": "object",
      "additionalProperties": {
        "type": "string",
        "minLength": 1
      }
    },
    "address": {
      "type": "object",
      "additionalProperties": false,
      "required": [
        "locality",
        "country"
      ],
      "properties": {
        "locality": {
          "type": "string",
          "minLength": 1
        },
        "country": {
          "type": "string",
          "minLength": 1
        }
      }
    },
    "contact": {
      "type": "object",
      "additionalProperties": false,
      "required": [
        "mobilePhone",
        "officePhone",
        "email",
        "hoursOpen",
        "hoursClose",
        "mapQuery"
      ],
      "properties": {
        "mobilePhone": {
          "type": "string",
          "minLength": 1
        },
        "officePhone": {
          "type": "string",
          "minLength": 1
        },
        "email": {
          "type": "string",
          "format": "email",
          "minLength": 1
        },
        "hoursOpen": {
          "type": "string",
          "minLength": 1
        },
        "hoursClose": {
          "type": "string",
          "minLength": 1
        },
        "mapQuery": {
          "type": "string",
          "minLength": 1
        }
      }
    },
    "social": {
      "type": "object",
      "additionalProperties": false,
      "required": [
        "whatsappPhone",
        "telegramUsername",
        "instagramUsername"
      ],
      "properties": {
        "whatsappPhone": {
          "type": "string",
          "minLength": 1
        },
        "telegramUsername": {
          "type": "string",
          "minLength": 1
        },
        "instagramUsername": {
          "type": "string",
          "minLength": 1
        }
      }
    }
  }
}
